{
  "eventId": "9b2c4e6a-1f3d-4a5b-8c7d-0e1f2a3b4c5d",
  "type": "booking.confirmed",
  "version": 1,
  "occurredAt": "2026-11-16T14:04:10+09:00",
  "producer": "booking",
  "traceId": "4bf92f3577b34da6a3ce929d0e0e4736",
  "payload": {
    "bookingId": 9876,
    "userId": "c1d2e3f4-a5b6-4c7d-8e9f-0a1b2c3d4e5f",
    "screeningId": 5123,
    "movieTitle": "영화 제목",
    "theaterName": "건대입구",
    "auditoriumName": "6관",
    "startsAt": "2026-11-16T14:30:00+09:00",
    "seatLabels": [
      "J7",
      "J8"
    ],
    "seatCount": 2,
    "amount": 30000,
    "confirmedAt": "2026-11-16T14:04:10+09:00"
  }
}
